{
  "label": "c3",
  "resolved_names": [
    "differentiated keratinocyte",
    "differentiated KC"
  ],
  "scope": "adult",
  "tissue_context": "adult skin epidermis",
  "confidence": "high",
  "evidence": "Fig. 4D legend: undifferentiated KC (clusters 1, 5), proliferating (cluster 2), differentiated KC (clusters 3, 4, 6, 7), differentiated KC* (cluster 8)"
}