{
  "label": "DPYSL2+ basal",
  "resolved_names": [
    "DPYSL2-positive basal keratinocyte"
  ],
  "scope": "fetal",
  "tissue_context": "fetal skin (prenatal human skin, 7-17 PCW)",
  "confidence": "high",
  "evidence": "The label 'DPYSL2+ basal' is used in the Gopee et al. (2024) prenatal skin atlas (Supplementary Table 6) as a fine-grained cell type annotation in the fetal scope. Resolved to 'DPYSL2-positive basal keratinocyte' based on atlas text, figures, and supplementary data."
}