{
  "label": "Pericyte_1_non_inflamm",
  "resolved_names": [
    "Pericyte_1_non_inflamm"
  ],
  "scope": "adult",
  "tissue_context": "skin",
  "confidence": "medium",
  "evidence": "The main text and provided content refer to mural cells in the dermis, including pericytes, but do not provide an explicit mapping of the label 'Pericyte_1_non_inflamm' to a more descriptive cell type name. The label matches the cluster nomenclature style typically used in cell atlas supplementary information, likely referring to a pericyte subtype. However, since no exact full name or cluster annotation table is included in the supplied extract, the cluster is returned as-is and flagged as possibly unresolved."
}